{
  "record_id": "RR-0003",
  "incident_id": "NEPAL-RASUWA-2026",
  "source_id": "SRC-DAO-MAKWANPUR-0001",
  "source_record_reference": "official-list-original-serial-62",
  "original_name": "सुमन थिङ लामा",
  "original_text": null,
  "original_language": "ne",
  "transliteration": "Suman Thing Lama",
  "reported_age": 32,
  "reported_address": "Hetauda-6, Chowghada",
  "reported_locality": "Chowghada",
  "reported_ward": "Hetauda-6",
  "reported_district": "Makwanpur",
  "reported_phone_numbers": ["9764537919"],
  "reported_vehicle": "12-wheel trailer",
  "reported_registration": "M P 03001 K 3617",
  "reported_purpose": "went to load goods",
  "reported_status": "OUT_OF_CONTACT",
  "photo_reference": null,
  "publication_date": "2083-05-12",
  "event_date": "2026-08-26",
  "retrieved_at": "2026-08-29",
  "notes": "Official candidate B. Exact ward + locality match family appeal; extended name and contact differ."
}
