{
  "record_id": "RR-0104",
  "incident_id": "NEPAL-RASUWA-2026",
  "source_id": "SRC-NEPAL-POLICE-UDB-MISSING-0001",
  "source_record_reference": "indexed-current-result",
  "original_name": "कुमाया गुरुङ",
  "transliteration": "Kumaya Gurung",
  "reported_age": 52,
  "reported_address": "Bharatpur Metropolitan City-13, Chitwan",
  "reported_locality": null,
  "reported_ward": "13",
  "reported_district": "Chitwan",
  "reported_phone_numbers": [],
  "reported_vehicle": null,
  "reported_registration": null,
  "reported_status": "MISSING_OFFICIALLY_RECORDED",
  "event_date": "2026-08-26",
  "retrieved_at": "2026-08-29",
  "notes": "Disappearance location reported as Rasuwa. Raw cohort seed only."
}
