{
  "record_id": "RR-0001",
  "incident_id": "NEPAL-RASUWA-2026",
  "source_id": "SRC-FAMILY-0001",
  "source_record_reference": "family-public-appeal",
  "original_name": "Suman Tamang",
  "original_text": "रसुवा मा बाढी पछि सम्पर्क विहिन भएको",
  "original_language": "ne",
  "transliteration": "Suman Tamang",
  "reported_age": null,
  "reported_address": "Hetauda Sub-Metropolitan City Ward 6, Chowghada, Makwanpur",
  "reported_locality": "Chowghada",
  "reported_ward": "Hetauda-6",
  "reported_district": "Makwanpur",
  "reported_phone_numbers": ["9860106481", "9823508648"],
  "reported_vehicle": null,
  "reported_registration": null,
  "reported_purpose": null,
  "reported_status": "OUT_OF_CONTACT",
  "photo_reference": "family-appeal-photo-not-yet-preserved",
  "publication_date": null,
  "event_date": "2026-08-26",
  "retrieved_at": "2026-08-29",
  "notes": "Family/community appeal. Known machine translation suggesting a vehicle was taken from home is rejected as incorrect."
}
