{
  "record_id": "RR-0101",
  "incident_id": "NEPAL-RASUWA-2026",
  "source_id": "SRC-NEPAL-POLICE-UDB-MISSING-0001",
  "source_record_reference": "indexed-current-result",
  "original_name": "राम भक्त नेवार",
  "transliteration": "Ram Bhakta Newar",
  "reported_age": 36,
  "reported_address": "Chhathar Rural Municipality-9, Tehrathum",
  "reported_locality": null,
  "reported_ward": "9",
  "reported_district": "Tehrathum",
  "reported_phone_numbers": [],
  "reported_vehicle": null,
  "reported_registration": null,
  "reported_status": "MISSING_OFFICIALLY_RECORDED",
  "event_date": "2026-08-26",
  "retrieved_at": "2026-08-29",
  "notes": "Disappearance location reported as Uttargaya Rural Municipality, Rasuwa. Raw cohort seed only; no canonical person cluster created yet."
}
