{
  "record_id": "RR-0105",
  "incident_id": "NEPAL-RASUWA-2026",
  "source_id": "SRC-NEPAL-POLICE-UDB-MISSING-0001",
  "source_record_reference": "indexed-current-result",
  "original_name": "लिला बहादुर थापा",
  "transliteration": "Lila Bahadur Thapa",
  "reported_age": 42,
  "reported_address": "Pokhara Metropolitan City-12, Kaski",
  "reported_locality": "Jaya Tol",
  "reported_ward": "12",
  "reported_district": "Kaski",
  "reported_phone_numbers": [],
  "reported_vehicle": null,
  "reported_registration": null,
  "reported_status": "MISSING_OFFICIALLY_RECORDED",
  "event_date": "2026-08-26",
  "retrieved_at": "2026-08-29",
  "notes": "Disappearance location reported as Rasuwa. Raw cohort seed only."
}
