{
  "record_id": "RR-0103",
  "incident_id": "NEPAL-RASUWA-2026",
  "source_id": "SRC-NEPAL-POLICE-UDB-MISSING-0001",
  "source_record_reference": "indexed-current-result",
  "original_name": "माया तामाङ",
  "transliteration": "Maya Tamang",
  "reported_age": 53,
  "reported_address": "Pokhara Metropolitan City-09, Kaski",
  "reported_locality": "Shibtol",
  "reported_ward": "09",
  "reported_district": "Kaski",
  "reported_phone_numbers": [],
  "reported_vehicle": null,
  "reported_registration": null,
  "reported_status": "MISSING_OFFICIALLY_RECORDED",
  "event_date": "2026-08-26",
  "retrieved_at": "2026-08-29",
  "notes": "Disappearance location reported as Rasuwa. Raw cohort seed only."
}
