{
  "record_id": "RR-0002",
  "incident_id": "NEPAL-RASUWA-2026",
  "source_id": "SRC-DAO-MAKWANPUR-0001",
  "source_record_reference": "official-list-serial-50",
  "original_name": "सुमन तामाङ",
  "original_text": null,
  "original_language": "ne",
  "transliteration": "Suman Tamang",
  "reported_age": null,
  "reported_address": "Hetauda-6",
  "reported_locality": null,
  "reported_ward": "Hetauda-6",
  "reported_district": "Makwanpur",
  "reported_phone_numbers": ["9861832613"],
  "reported_vehicle": null,
  "reported_registration": null,
  "reported_purpose": null,
  "reported_status": "OUT_OF_CONTACT",
  "photo_reference": null,
  "publication_date": "2083-05-12",
  "event_date": "2026-08-26",
  "retrieved_at": "2026-08-29",
  "notes": "Official candidate A. Exact name + ward match; no hard bridge to family subject."
}
