{
  "record_id": "RR-0102",
  "incident_id": "NEPAL-RASUWA-2026",
  "source_id": "SRC-NEPAL-POLICE-UDB-MISSING-0001",
  "source_record_reference": "indexed-current-result",
  "original_name": "सुर्य बहादुर कार्की",
  "transliteration": "Surya Bahadur Karki",
  "reported_age": 42,
  "reported_address": "Sundarharaicha Municipality-12, Morang",
  "reported_locality": "Mailung",
  "reported_ward": "12",
  "reported_district": "Morang",
  "reported_phone_numbers": [],
  "reported_vehicle": null,
  "reported_registration": null,
  "reported_status": "MISSING_OFFICIALLY_RECORDED",
  "event_date": "2026-08-26",
  "retrieved_at": "2026-08-29",
  "notes": "Disappearance location reported as Uttargaya Rural Municipality-12, Mailung, Rasuwa. Raw cohort seed only."
}
